country,clinic_name,location,website,source_type,discovery_source,review_status,validation,evidence
Germany,Johanniter-Klinik Godeshöhe,"Bonn, North Rhine-Westphalia",https://www.godeshoehe.de/,curated | curated-dataset | germany-pilot-official-seed,src/lib/data/centers.js | official clinic site,known,verified in app | known (strict),Official page matched neurological intensive medicine and early rehabilitation | Matched MS and Parkinson evidence | Relevant for severe acquired neurological injuries and stroke || neurologische intensivmedizin | multiple sklerose | morbus parkinson | rehabilitation | rehab | neurolog | neuro | parkinson | klinik | zentrum
Germany,KLINIK BAVARIA Kreischa,"Kreischa, Saxony",https://www.klinik-bavaria.de/,curated | curated-dataset | germany-pilot-official-seed,src/lib/data/centers.js | official clinic site,known,verified in app | known (strict),Intensive rehab including early rehabilitation | Motor and cognitive rehabilitation starts immediately | Neurology is part of the medical spectrum || neurologie | intensivrehabilitation | rehabilitation | rehab | neurolog | neuro | klinik | center
Germany,Kliniken Schmieder,"Heidelberg, Baden-Württemberg",https://kliniken-schmieder.com/hospital/konstanz/,curated | curated-dataset | germany-pilot-official-seed,src/lib/data/centers.js | Kliniken Schmieder official site,known,verified in app | known (strict),Network umbrella page for neurological rehabilitation clinics | Own research institute | University hospital cooperation and measurable outcomes || неврологическая реабилитация | реабилитация | невролог | инсульт | черепно-мозгов | рассеянный склероз | klinik
Germany,Kliniken Schmieder Allensbach,"Allensbach, Baden-Württemberg",https://kliniken-schmieder.com/hospital/allensbach/,curated | curated-dataset | germany-pilot-official-seed,src/lib/data/centers.js | Kliniken Schmieder official site,known,verified in app | known (strict),Phase-based neurological rehabilitation | Part of the Schmieder research network | Early rehabilitation and day care || неврологическая реабилитация | реабилитация | невролог | инсульт | черепно-мозгов | рассеянный склероз | klinik
Germany,Kliniken Schmieder Gailingen,"Gailingen am Hochrhein, Baden-Württemberg",https://kliniken-schmieder.com/hospital/gailingen/,curated | curated-dataset | germany-pilot-official-seed,src/lib/data/centers.js | Kliniken Schmieder official site,known,verified in app | known (strict),"Official Schmieder location page matched neurological rehabilitation evidence | Part of the Schmieder neurological rehabilitation network | Relevant for stroke, brain injury, MS and Parkinson pathways || неврологическая реабилитация | реабилитация | невролог | инсульт | черепно-мозгов | рассеянный склероз | klinik"
Germany,Kliniken Schmieder Gerlingen,"Gerlingen, Baden-Württemberg",https://kliniken-schmieder.com/hospital/gerlingen/,curated | curated-dataset | germany-pilot-official-seed,src/lib/data/centers.js | Kliniken Schmieder official site,known,verified in app | known (strict),Neurological rehab across phases A-E | Part of the Schmieder research network || неврологическая реабилитация | реабилитация | невролог | инсульт | черепно-мозгов | рассеянный склероз | klinik
Germany,Kliniken Schmieder Heidelberg,"Heidelberg, Baden-Württemberg",https://kliniken-schmieder.com/hospital/heidelberg/,curated | curated-dataset | germany-pilot-official-seed,src/lib/data/centers.js | Kliniken Schmieder official site,known,verified in app | known (strict),Own research institute | University hospital cooperation | Measurable outcomes from admission to discharge || неврологическая реабилитация | реабилитация | невролог | инсульт | черепно-мозгов | рассеянный склероз | klinik
Germany,Kliniken Schmieder Konstanz,"Konstanz, Baden-Württemberg",https://kliniken-schmieder.com/,curated | curated-dataset,src/lib/data/centers.js,known,verified in app | known (strict),Lurija Institute for rehabilitation sciences and health research | Network of specialized neurological rehabilitation clinics | University-linked continuing education || neurorehabilitation | neurological rehabilitation | rehabilitation | rehab | neurolog | neuro | stroke | spinal | clinic | klinik
Germany,Kliniken Schmieder Stuttgart,"Stuttgart, Baden-Württemberg",https://kliniken-schmieder.com/hospital/stuttgart/,curated | curated-dataset | germany-pilot-official-seed,src/lib/data/centers.js | Kliniken Schmieder official site,known,verified in app | known (strict),Day-clinic and outpatient neurological rehabilitation | Part of the Schmieder research network || неврологическая реабилитация | реабилитация | невролог | инсульт | черепно-мозгов | рассеянный склероз | klinik
Germany,m&i-Fachklinik Bad Heilbrunn,"Bad Heilbrunn, Bavaria",https://www.fachklinik-bad-heilbrunn.de/,curated | curated-dataset | germany-pilot-official-seed,src/lib/data/centers.js | m&i Klinikgruppe Enzensberg official site,known,verified in app | known (broad),Official clinic page matched rehabilitation and neurological signals | Part of the m&i specialist rehabilitation clinic group | Broad candidate requiring normal manual confirmation depth || rehabilitation | rehab | neurolog | neuro | klinik | zentrum
Germany,m&i-Fachklinik Bad Liebenstein,"Bad Liebenstein, Thuringia",https://www.fachklinik-bad-liebenstein.de/,curated | curated-dataset | germany-pilot-official-seed,src/lib/data/centers.js | m&i Klinikgruppe Enzensberg official site,known,verified in app | known (strict),Official site matched neurorehabilitation and weaning evidence | m&i specialist rehabilitation clinic | Relevant for complex neurological rehabilitation and respiratory transition care || weaning | neurorehabilitation | rehabilitation | rehab | neurolog | neuro | klinik
Germany,m&i-Fachklinik Enzensberg,"Füssen, Bavaria",https://www.fachklinik-enzensberg.de/,curated | curated-dataset | germany-pilot-official-seed,src/lib/data/centers.js | m&i Klinikgruppe Enzensberg official site,known,verified in app | known (strict),Official site matched phase B and neurological rehabilitation signals | m&i specialist clinic in Bavaria | Relevant for staged neurological rehabilitation || phase b | rehabilitation | rehab | neurolog | neuro | klinik | zentrum
Germany,m&i-Fachklinik Herzogenaurach,"Herzogenaurach, Bavaria",https://www.fachklinik-herzogenaurach.de/,curated | curated-dataset | germany-pilot-official-seed,src/lib/data/centers.js | m&i Klinikgruppe Enzensberg official site,known,verified in app | known (broad),Official clinic page matched rehabilitation and neurological signals | Part of the m&i specialist rehabilitation group | Broad approved candidate for neurological rehabilitation review || rehabilitation | rehab | neurolog | neuro | klinik | zentrum
Germany,m&i-Fachklinik Ichenhausen,"Ichenhausen, Bavaria",https://www.fachklinik-ichenhausen.de/,curated | curated-dataset | germany-pilot-official-seed,src/lib/data/centers.js | m&i Klinikgruppe Enzensberg official site,known,verified in app | known (strict),Official site matched neurology and Parkinson evidence | m&i specialist rehabilitation clinic | Relevant for Parkinson and acquired neurological rehabilitation || neurologie | parkinson | rehabilitation | rehab | neurolog | neuro | klinik
Germany,m&i-Fachkliniken Hohenurach,"Bad Urach, Baden-Württemberg",https://www.fachkliniken-hohenurach.de/,curated | curated-dataset | germany-pilot-official-seed,src/lib/data/centers.js | m&i Klinikgruppe Enzensberg official site,known,verified in app | known (strict),Official site matched neuropsychology and stroke evidence | m&i specialist rehabilitation clinic | Relevant for stroke and cognitive-neurological rehabilitation || neuropsychologie | schlaganfall | rehabilitation | rehab | neurolog | neuro | klinik | zentrum
Germany,Marcus Klinik Bad Driburg,"Bad Driburg, North Rhine-Westphalia",https://www.marcus-klinik.de/,curated | curated-dataset | germany-pilot-official-seed,src/lib/data/centers.js | official clinic site,known,verified in app | known (strict),Official site matched neurology and Parkinson evidence | Rehabilitation clinic rather than generic physiotherapy | Relevant for neurological rehabilitation review || neurologie | parkinson | rehabilitation | rehab | neurolog | neuro | klinik
Germany,MEDIAN Klinik Berlin-Kladow,"Berlin, Berlin",https://www.median-kliniken.de/de/median-klinik-berlin-kladow/,curated | curated-dataset | germany-second-pass-official-seed,src/lib/data/centers.js | MEDIAN clinic group / neurological rehabilitation seed,known,verified in app | known (strict),Official page matched neurological rehabilitation evidence | Second-pass candidate approved for Berlin coverage | Relevant for stroke and acquired neurological rehabilitation || neurologische rehabilitation | neurologie | schlaganfall | rehabilitation | rehab | neurolog | neuro | klinik
Germany,MEDIAN Klinik Flechtingen,"Flechtingen, Saxony-Anhalt",https://www.median-kliniken.de/de/median-klinik-flechtingen/,curated | curated-dataset | germany-second-pass-official-seed,src/lib/data/centers.js | MEDIAN clinic group / neurological rehabilitation seed,known,verified in app | known (strict),Official page matched neurology and phase B evidence | MEDIAN specialist rehabilitation provider | Relevant for early and staged neurological rehabilitation || neurologie | phase b | rehabilitation | rehab | neurolog | neuro | klinik
Germany,MEDIAN Klinik Gyhum,"Gyhum, Lower Saxony",https://www.median-kliniken.de/de/median-klinik-gyhum/,curated | curated-dataset | germany-second-pass-official-seed,src/lib/data/centers.js | MEDIAN clinic group / neurological rehabilitation seed,known,verified in app | known (strict),Official page matched neurology and rehabilitation evidence | Second-pass MEDIAN candidate approved for Lower Saxony coverage | Relevant for neurological rehabilitation review || neurologie | rehabilitation | rehab | neurolog | neuro | klinik
Germany,MEDIAN Klinik Kalbe,"Kalbe, Saxony-Anhalt",https://www.median-kliniken.de/de/median-klinik-kalbe/,curated | curated-dataset | germany-second-pass-official-seed,src/lib/data/centers.js | MEDIAN clinic group / neurological rehabilitation seed,known,verified in app | known (strict),Official page matched neurology and rehabilitation evidence | MEDIAN specialist rehabilitation provider | Adds Saxony-Anhalt neurological rehab coverage || neurologie | rehabilitation | rehab | neurolog | neuro | klinik
Germany,MEDIAN Klinik NRZ Magdeburg,"Magdeburg, Saxony-Anhalt",https://www.median-kliniken.de/de/median-klinik-nrz-magdeburg/,curated | curated-dataset | germany-second-pass-official-seed,src/lib/data/centers.js | MEDIAN clinic group / neurological rehabilitation seed,known,verified in app | known (strict),Official page matched neurological rehabilitation and neurorehabilitation evidence | NRZ specialist neurorehabilitation profile | Relevant for stroke and complex neurological recovery || neurologische rehabilitation | schlaganfall | neurorehabilitation | rehabilitation | rehab | neurolog | neuro | klinik
Germany,MEDIAN Klinik Wilhelmshaven,"Wilhelmshaven, Lower Saxony",https://www.median-kliniken.de/de/median-klinik-wilhelmshaven/,curated | curated-dataset | germany-second-pass-official-seed,src/lib/data/centers.js | MEDIAN clinic group / neurological rehabilitation seed,known,verified in app | known (strict),"Official page matched neurology, rehabilitation, stroke and neurorehabilitation evidence | Second-pass MEDIAN candidate approved for coastal Lower Saxony coverage | Relevant for neurological rehabilitation review || neurologie | rehabilitation | schlaganfall | neurorehabilitation | rehab | neurolog | neuro | klinik"
Germany,MediClin Fachklinik Rhein/Ruhr,"Essen, North Rhine-Westphalia",https://www.fachklinik-rheinruhr.de/,curated | curated-dataset | germany-pilot-official-seed,src/lib/data/centers.js | MediClin official site / specialist rehab clinic,known,verified in app | known (strict),"Official site matched neurology, stroke and multiple sclerosis evidence | MediClin specialist rehabilitation provider | Relevant for neurological rehabilitation in North Rhine-Westphalia || neurologie | schlaganfall | multiple sklerose | rehabilitation | rehab | neurolog | neuro | klinik | klinika"
Germany,MediClin Hedon Klinik,"Lingen, Lower Saxony",https://www.hedon-klinik.de/,germany-pilot-official-seed,MediClin official site / specialist rehab clinic,error,error (none),fetch failed; curl fallback failed: curl: (6) Could not resolve host: www.hedon-klinik.de
Germany,Moritz Klinik Bad Klosterlausnitz,"Bad Klosterlausnitz, Thuringia",https://www.moritz-klinik.de/,curated | curated-dataset | germany-pilot-official-seed,src/lib/data/centers.js | official clinic site,known,verified in app | known (strict),"Official site matched neurology, rehabilitation and stroke evidence | Specialist rehabilitation clinic in Thuringia | Relevant for neurological and stroke rehabilitation || neurologie | rehabilitation | schlaganfall | rehab | neurolog | neuro | klinik"
Germany,Passauer Wolf Bad Gögging,"Bad Gögging, Bavaria",https://www.passauerwolf.de/standorte/bad-goegging/,curated | curated-dataset | germany-second-pass-official-seed,src/lib/data/centers.js | Passauer Wolf specialist rehabilitation group seed,known,verified in app | known (strict),"Official page matched neurology, stroke and Parkinson evidence | Passauer Wolf specialist rehabilitation provider | Relevant for neurological and Parkinson rehabilitation pathways || neurologie | rehabilitation | schlaganfall | parkinson | rehab | neurolog | neuro | klinik | zentrum"
Germany,Passauer Wolf Bad Griesbach,"Bad Griesbach, Bavaria",https://www.passauerwolf.de/standorte/bad-griesbach/,curated | curated-dataset | germany-second-pass-official-seed,src/lib/data/centers.js | Passauer Wolf specialist rehabilitation group seed,known,verified in app | known (strict),"Official page matched neurology, stroke and Parkinson evidence | Passauer Wolf specialist rehabilitation provider | Relevant for neurological rehabilitation in Bavaria || neurologie | rehabilitation | schlaganfall | parkinson | rehab | neurolog | neuro | klinik | zentrum"
Germany,Passauer Wolf Nittenau,"Nittenau, Bavaria",https://www.passauerwolf.de/standorte/nittenau/,curated | curated-dataset | germany-second-pass-official-seed,src/lib/data/centers.js | Passauer Wolf specialist rehabilitation group seed,known,verified in app | known (strict),"Official page matched neurology, stroke and Parkinson evidence | Passauer Wolf specialist rehabilitation provider | Relevant for neurological and Parkinson rehabilitation pathways || neurologie | rehabilitation | schlaganfall | parkinson | rehab | neurolog | neuro | klinik | zentrum"
Germany,RehaNova Köln,"Cologne, North Rhine-Westphalia",https://www.rehanova.de/,curated | curated-dataset | germany-pilot-official-seed,src/lib/data/centers.js | official clinic site,known,verified in app | known (strict),"Official site describes a neurological-neurosurgical rehabilitation clinic | Matched phase B-D, stroke, MS and Parkinson signals | Strong candidate for complex inpatient neurorehabilitation || neurologisch-neurochirurgische rehabilitationsklinik | phase b-d | schlaganfall | multiple sklerose | parkinson | neurologische rehabilitation | rehabilitation | rehab | neurolog | neuro | clinic | klinik"
Germany,Sankt Rochus Kliniken,"Bad Schönborn, Baden-Württemberg",https://www.sankt-rochus-kliniken.de/,curated | curated-dataset | germany-pilot-official-seed,src/lib/data/centers.js | official clinic site,known,verified in app | known (strict),Neurological early rehabilitation phase B/C/D | Official studies and research section | Ambulatory rehabilitation and neurology department || neurologische rehabilitation | phase b | phase c | phase d | rehabilitation | rehab | neurolog | neuro | klinik
Germany,Schön Klinik Bad Aibling Harthausen,"Bad Aibling, Bavaria",https://www.schoen-klinik.de/bad-aibling-harthausen,curated | curated-dataset | germany-pilot-official-seed,src/lib/data/centers.js | official clinic site,known,verified in app | known (strict),Neurological early rehabilitation and acute neurology | Official research and teaching section | Robotics listed as part of the treatment standard || stroke unit | schlaganfall | parkinson | rehabilitation | rehab | neurolog | neuro | stroke | spinal | klinik | zentrum
Germany,SRH Fachkrankenhaus Neresheim,"Neresheim, Baden-Württemberg",https://www.fachkrankenhaus-neresheim.de/,curated | curated-dataset | germany-second-pass-official-seed,src/lib/data/centers.js | SRH specialist hospital / neurological early rehabilitation seed,known,verified in app | known (strict),Official page matched intensive medicine and neurological evidence | Specialist hospital seeded for neurological early rehabilitation | Relevant for severe brain injury and early recovery pathways || intensivmedizin | rehabilitation | rehab | neurolog | neuro | klinik
Germany,SRH Kurpfalzkrankenhaus Heidelberg,"Heidelberg, Baden-Württemberg",https://www.kurpfalzkrankenhaus.de/,curated | curated-dataset | germany-pilot-official-seed,src/lib/data/centers.js | official hospital site / specialist neurology hospital,known,verified in app | known (strict),Official hospital page matched neurology signals | Seeded as a specialist neurology hospital with early rehabilitation relevance | Adds Heidelberg neurorehabilitation coverage beyond the Schmieder network || neurologie | neurolog | neuro | klinik
Germany,Vitrea Klinik Hattingen,"Hattingen, North Rhine-Westphalia",https://www.vitrea-gesundheit.de/reha/hattingen/,curated | curated-dataset | germany-second-pass-official-seed,src/lib/data/centers.js | Vitrea / former VAMED neurological rehabilitation seed,known,verified in app | known (strict),"Official page matched neurology, neurosurgery and rehabilitation evidence | Relevant for adult and pediatric neurological rehabilitation review | Specialist neurorehabilitation provider in North Rhine-Westphalia || neurologie | neurochirurgie | rehabilitation | rehab | neurolog | neuro | klinik | zentrum"
Hungary,National Center for Spinal Disorders,"Budapest, Budapest",https://nepegeszsegugyi-egyesulet.hu/en/national-center-spinal-disorders-buda-health-center,curated | curated-dataset,src/lib/data/centers.js,known,verified in app | known (none),"Official site is a spinal-disorders reference page | Crawling was blocked, so this is a manual official-source fallback || center"
Italy,Auxologico Meda Riabilitazione,"Meda, Lombardia",https://www.auxologico.it/sedi/auxologico-meda-riabilitazione,curated | curated-dataset,src/lib/data/centers.js,known,verified in app | known (broad),"An outpatient rehabilitation center with multidisciplinary care for neuromotor, cognitive and prevention needs. || riabilitazione | neurolog | neuro | centro"
Italy,Centro di riabilitazione Villa Beretta,"Costa Masnaga, Lombardia",https://www.valduce.it/it/chi-siamo/centro-di-riabilitazione-villa-beretta,curated | curated-dataset,src/lib/data/centers.js,known,verified in app | known (broad),"A rehabilitation center specialized in central nervous system injuries, with an interdisciplinary model and advanced technology. || rehabilitation | rehab | riabilitazione | neurolog | neuro | ictus | spinal | centro"
Italy,Centro Giusti Firenze,"Florence, Tuscany",https://www.centrogiusti.eu/,curated | curated-dataset,src/lib/data/centers.js,known,verified in app | known (broad),Official site explicitly targets neurological patients and spinal cord lesions | RIC pathway for neurological patients | HAL exoskeleton and other robotic rehabilitation tools || rehabilitation | rehab | riabilitazione | neurolog | neuro | ictus | lesioni midollari | centro
Italy,CRiS — Città di Rovigo,"Rovigo, Veneto",https://cris.cittadirovigo.it/,curated | curated-dataset,src/lib/data/centers.js,known,verified in app | known (strict),"A clinic for physical and cognitive rehabilitation of nervous system disorders, including telerehabilitation. || neuroriabilitazione | riabilitazione neurologica | riabilitazione | neurolog | neuro | ictus | spinal | clinic | centro"
Italy,Fondazione Santa Lucia IRCCS,"Roma, Lazio",https://www.hsantalucia.it/servizi-sanitari/riabilitazione-neuromotoria,curated | curated-dataset,src/lib/data/centers.js,known,verified in app | known (strict),"A highly specialized hospital for motor and cognitive neurorehabilitation, with multidisciplinary pathways and advanced technology. || neuroriabilitazione | riabilitazione | neurolog | neuro | ictus | parkinson | hospital | centro"
Italy,Fondazione Turati - Centro di Riabilitazione di Vieste,"Vieste, Puglia",https://fondazioneturati.it/centri-di-riabilitazione-e-terapia-fisica/centro-di-riabilitazione-a-vieste-della-fondazione-turati,curated | curated-dataset | italy-first-pass-official-seed,src/lib/data/centers.js | official Fondazione Turati Vieste rehabilitation centre page,known,verified in app | known (strict),Official page lists neurological and neuromotor rehabilitation | Official page lists residential and outpatient rehabilitation | Official page states access through the Italian National Health Service and private care || riabilitazione | neurologica | neuromotorie | residenziale | ambulatoriale | Sistema Sanitario Nazionale | neurolog | neuro | parkinson | centro
Italy,IRCCS Centro Neurolesi Bonino Pulejo,"Messina, Sicilia",https://www.irccsme.it/servizi/riabilitazione-robotica/,curated | curated-dataset,src/lib/data/centers.js,known,verified in app | known (broad),"A highly specialized center for neuromotor, cognitive and robotic rehabilitation, including severe brain injury care. || riabilitazione | neurolog | neuro | clinic | centro"
Italy,IRCCS Eugenio Medea,"Bosisio Parini, Lombardia",https://emedea.it/,curated | curated-dataset,src/lib/data/centers.js,known,verified in app | known (strict),"An IRCCS focused on research, care and rehabilitation for neurological and neuropsychiatric disabilities in children. || neuroriabilitazione | riabilitazione | neuro"
Italy,IRCCS Maugeri Castel Goffredo,"Castel Goffredo, Lombardia",https://www.icsmaugeri.it/dove-siamo/irccs-castel-goffredo,curated | curated-dataset,src/lib/data/centers.js,known,verified in app | known (broad),A site with neurological specialties and neuromotor rehabilitation in the functional care pathway. || riabilitazione | neurolog | neuro
Italy,IRCCS Maugeri Montescano,"Montescano, Lombardia",https://www.icsmaugeri.it/dove-siamo/irccs-montescano,curated | curated-dataset,src/lib/data/centers.js,known,verified in app | known (broad),"An IRCCS with a strong rehabilitation focus, including neuromotor rehabilitation and neurophysiology. || riabilitazione | neuro"
Italy,IRCCS Maugeri Pavia,"Pavia, Lombardia",https://www.icsmaugeri.it/dove-siamo/irccs-pavia,curated | curated-dataset,src/lib/data/centers.js,known,verified in app | known (broad),An IRCCS site oriented toward neuromotor rehabilitation and multidisciplinary functional recovery pathways. || riabilitazione | neuro | centro
Italy,IRCCS Maugeri Telese Terme,"Telese Terme, Campania",https://www.icsmaugeri.it/dove-siamo/irccs-telese,curated | curated-dataset | italy-first-pass-official-seed,src/lib/data/centers.js | official Maugeri Telese Terme site and specialty pages,known,verified in app | known (strict),Official Maugeri page lists riabilitazione neuromotoria | Official page lists gravi cerebrolesioni and riabilitazione spinale | Official specialty evidence includes Parkinson and sclerosi multipla || Riabilitazione neuromotoria | Gravi cerebrolesioni | Riabilitazione spinale | Stati vegetativi persistenti | riabilitazione | neuro | spinal | clinic
Italy,IRCCS Maugeri Veruno,"Gattico-Veruno, Piemonte",https://www.icsmaugeri.it/dove-siamo/irccs-veruno,curated | curated-dataset,src/lib/data/centers.js,known,verified in app | known (broad),An institute with neurology and physical rehabilitation suited to neuromotor recovery pathways. || riabilitazione | neurolog | neuro | clinic
Italy,IRCCS Neuromed - Neuroriabilitazione,"Pozzilli, Molise",https://neuromed.it/reparti/neuroriabilitazione,curated | curated-dataset | italy-first-pass-official-seed,src/lib/data/centers.js | official Neuromed neurorehabilitation department page,known,verified in app | known (strict),"Official department page is dedicated to neuroriabilitazione | Matched intensive rehabilitation codes 75 and 56 | Official page lists multiple sclerosis, Parkinson and robotic rehabilitation evidence || Neuroriabilitazione | codice 75 | codice 56 | Sclerosi Multipla | Parkinson | riabilitazione robotica | neuroriabilitazione | riabilitazione | neurolog | neuro | spinal | parkinson"
Italy,IRCCS S. Maria Nascente — Don Gnocchi,"Milano, Lombardia",https://www.dongnocchi.it/@strutture/centro-irccs-s-maria-nascente,curated | curated-dataset,src/lib/data/centers.js,known,verified in app | known (broad),"An intensive neurological rehabilitation unit for cerebrovascular, neurodegenerative, spinal and neuromuscular conditions. || rehabilitation | rehab | riabilitazione | neurolog | neuro | parkinson"
