country,clinic_name,location,website,source_type,discovery_source,review_status,validation,evidence
Italy,Montecatone Rehabilitation Institute,"Imola, Emilia-Romagna",https://www.montecatone.com/,curated | curated-dataset,src/lib/data/centers.js,known,verified in app | known (strict),A highly specialized center for intensive rehabilitation after spinal cord and acquired brain injuries. || neuroriabilitazione | riabilitazione neurologica | rehabilitation | rehab | riabilitazione | neurolog | neuro | spinal | lesioni midollari | hospital
Italy,Ospedale San Camillo IRCCS,"Venezia Lido, Veneto",https://hsancamillo.it/ospedale-irccs-san-camillo-di-venezia,curated | curated-dataset | italy-first-pass-official-seed,src/lib/data/centers.js | official San Camillo IRCCS hospital profile,known,verified in app | known (strict),"Official IRCCS page states specialization in neuroriabilitazione | Matched brain lesion, ischemic lesion, spinal cord injury and multiple sclerosis evidence | Official page lists motor, communication and behavioral neurorehabilitation || Neuroriabilitazione | lesioni cerebrali | lesioni ischemiche | mielolesioni | Sclerosi Multipla | IRCCS | neuroriabilitazione | riabilitazione | neurolog | neuro | clinic"
Italy,Prosperius Villa Cherubini - Riabilitazione Neurologica,"Firenze, Toscana",https://prosperius.it/riabilitazione/riabilitazione-neurologica,curated | curated-dataset | italy-first-pass-official-seed,src/lib/data/centers.js | official Prosperius Villa Cherubini neurological rehabilitation page,known,verified in app | known (strict),"Official page is dedicated to riabilitazione neurologica | Matched stroke, multiple sclerosis and Parkinson evidence | Official page lists robotic rehabilitation and inpatient/outpatient pathways || Riabilitazione Neurologica | ictus cerebrale | Sclerosi Multipla | Parkinson | Riabilitazione robotica | ricovero | neuroriabilitazione | riabilitazione neurologica | rehabilitation | rehab | riabilitazione | neurolog | neuro | ictus | parkinson | hospital | clinic"
Netherlands,Roessingh,"Enschede, Overijssel",https://www.roessingh.nl/,curated | curated-dataset,src/lib/data/centers.js,known,verified in app | known (strict),"Innovatie & onderzoek | Patient satisfaction published on the official site | Specialist care for NAH, MS and Parkinson || Innovatie & onderzoek | revalidatie | neurolog | neuro | parkinson | dwarslaesie"
Norway,Sunnaas sykehus HF,"Bjørnemyr, Akershus",https://www.sunnaas.no/,curated | curated-dataset,src/lib/data/centers.js,known,verified in app | known (broad),Largest specialized hospital in physical medicine and rehabilitation in Norway | Own research department | Rehabilitation and research are central parts of the trust || rehab | spinal cord | spinal
Poland,Centrum Kompleksowej Rehabilitacji Konstancin,"Konstancin-Jeziorna, Masovian Voivodeship",https://ckr.pl/rehabilitacja/,curated | curated-dataset | poland-first-pass-official-seed,src/lib/data/centers.js | official CKR Konstancin rehabilitation centre site,known,verified in app | known (strict),"Official site states rehabilitation for stroke, neurosurgery, multiple sclerosis, Parkinson and polyneuropathies | Official exoskeleton page references lower-limb paresis/paralysis including complete spinal cord interruption | Official contact and service pages list NFZ and paid rehabilitation beds || Egzoszkielet | rehab | rehabilitacja | neurolog | neuro | oddział"
Poland,Centrum Origin Kraków,"Kraków, Lesser Poland Voivodeship",https://www.originpolska.com/placowka/centrum-origin-krakow/,curated | curated-dataset | poland-first-pass-official-seed,src/lib/data/centers.js | official Origin Polska Kraków rehabilitation centre page and programme navigation,known,verified in app | known (strict),"Official Origin Polska site describes private neurological and post-accident rehabilitation in Otwock and Kraków | Official programme navigation lists stroke, spinal cord injury, traumatic brain injury, Parkinson and neuropathy programmes | Official map data lists the Kraków rehabilitation centre address and coordinates || rehabilitacji neurologicznej | Udar mózgu | Urazy rdzenia kręgowego | Urazy mózgowo-czaszkowe | Choroba Parkinsona | Wyposażenie i robotyka | rehab | rehabilitacja | neurolog | neuro | udar mózgu | udarach mózgu"
Poland,Centrum Origin Otwock,"Otwock, Masovian Voivodeship",https://www.originpolska.com/placowka/centrum-origin-otwock/,curated | curated-dataset | poland-first-pass-official-seed,src/lib/data/centers.js | official Origin Polska Otwock rehabilitation centre page and programme navigation,known,verified in app | known (strict),"Official Origin Polska site describes private neurological and post-accident rehabilitation in Otwock and Kraków | Official programme navigation lists stroke, spinal cord injury, traumatic brain injury, Parkinson and neuropathy programmes | Official site lists rehabilitation robotics including ReoAmbulator and upper-limb robotic therapy || Udar mózgu | Urazy rdzenia kręgowego | Urazy mózgowo-czaszkowe | Choroba Parkinsona | Wyposażenie i robotyka | rehab | rehabilitacja | neurolog | neuro | udar mózgu | udarze"
Poland,Constance Care,"Kierszek, Masovian Voivodeship",https://constancecare.pl/pl/rehabilitacja-neurologiczna,curated | curated-dataset | poland-first-pass-official-seed,src/lib/data/centers.js | official Constance Care rehabilitation centre site,known,verified in app | known (strict),"Official site describes Constance Care as a private neurological and post-stroke rehabilitation centre | Official pages list rehabilitation after stroke, traumatic brain injury, spinal cord injury, neurological operations, MS and Parkinson | Official contact page provides centre address, phone and map coordinates || rehabilitacja neurologiczna | urazach czaszkowo-mózgowych | urazach rdzenia kręgowego | stwardnienie rozsiane | choroba Parkinsona | rehabilitacji neurologicznej | rehab | rehabilitacja | neurolog | neuro | udarach mózgu | po udarze"
Poland,"Górnośląskie Centrum Rehabilitacji ""Repty""","Tarnowskie Góry, Silesian Voivodeship",https://repty.pl/,curated | curated-dataset | poland-first-pass-official-seed,src/lib/data/centers.js | official Repty GCR rehabilitation hospital site,known,verified in app | known (strict),"Official hospital site lists neurological rehabilitation and post-hospital rehabilitation | Official metadata matches neurology, stroke-like conditions, multiple sclerosis, paralysis and paresis | Site navigation lists inpatient departments, rehabilitation clinic and day rehabilitation centre || rehabilitacja neurologiczna | rehab | rehabilitacja | neurolog | neuro | szpital | oddział"
Portugal,Centro de Medicina de Reabilitação de Alcoitão,"Alcoitão, Lisbon District",https://cmra.scml.pt/,curated | curated-dataset,src/lib/data/centers.js,known,verified in app | known (weak),Official Portuguese rehabilitation center with multidisciplinary services | Inpatient programs and rehab pathways listed on the official site | Longstanding rehabilitation institution serving the Lisbon area || reabilitação | centro
Slovenia,Center Korak,"Kranj, Upper Carniola",https://center-korak.si/zdravstvene-storitve/,curated | curated-dataset | slovenia-first-pass-official-seed,src/lib/data/centers.js | official Center Korak health-services page,known,verified in app | known (strict),"Official site defines Center Korak for people with acquired brain injury | Official health-services page states long-term rehabilitation for acquired brain injury | Official page lists neurophysiotherapy, occupational therapy and speech therapy || Dolgotrajna rehabilitacija za osebe s pridobljeno možgansko poškodbo | nevrofizioterapije | plastičnost živčnega sistema | Delovna terapija | Logopedske storitve | nevrofizioterapija | dolgotrajna rehabilitacija | rehabilitacija za osebe s pridobljeno možgansko poškodbo | rehab | rehabilitacija | pridobljeno možgansko poškodbo | možganski poškodbi | živčnega sistema | center"
Slovenia,Center Naprej,"Maribor, Styria",https://www.center-naprej.si/rehabilitacija,curated | curated-dataset | slovenia-first-pass-official-seed,src/lib/data/centers.js | official Center Naprej rehabilitation page,known,verified in app | known (strict),"Official site defines Center Naprej as a centre for people with acquired brain injury | Official rehabilitation page describes long-term interdisciplinary rehabilitation after acquired brain injury | Official neurophysiotherapy page lists neurorehabilitation, Bobath, PNF, motor relearning and robotic arm rehabilitation || dolgotrajni rehabilitaciji | nevrološke okvare | Nevroplastičnost možganov | interdisciplinarno | nevrofizioterapija | dolgotrajna rehabilitacija | rehab | rehabilitacija | rehabilitacije | avc | center | zavod"
Slovenia,URI Soča,"Ljubljana, Ljubljana",https://www.uri-soca.si/en/medical-rehabilitation/,curated | curated-dataset | slovenia-first-pass-official-seed,src/lib/data/centers.js | official URI Soča medical rehabilitation page,known,verified in app | known (strict),"Official medical rehabilitation page describes comprehensive rehabilitation for central and peripheral nervous-system disorders | Dedicated departments cover traumatic brain injury, multiple sclerosis, stroke and spinal lesions | Services include inpatient and outpatient rehabilitation plus physiotherapy, occupational therapy, psychology and speech therapy || central and peripheral nervous system disorders | Traumatic Brain Injury | Multiple Sclerosis | after Stroke | Spinal Lesions | (Re)habilitation of Children | rehabilitation | rehab | neurolog | neuro | stroke | spinal cord"
Spain,CEADAC - Centro de Referencia Estatal de Atención al Daño Cerebral,"Madrid, Community of Madrid",https://ceadac.imserso.es/,curated | curated-dataset | spain-first-pass-official-seed,src/lib/data/centers.js | official Imserso state reference centre page,known,verified in app | known (strict),Official Imserso state reference centre for acquired brain injury | Official page describes comprehensive rehabilitation for people with brain injury | Public reference centre with direct-care services || Centro de Referencia Estatal de Atención al Daño Cerebral | daño cerebral | daño cerebral adquirido | servicios de atención directa | rehab | rehabilitación | centro
Spain,Centro Casaverde Madrid,"Madrid, Community of Madrid",https://casaverdeneuro.com/centros/madrid/centro-casaverde-madrid/,curated | curated-dataset | spain-first-pass-official-seed,src/lib/data/centers.js | official Casaverde Neuro centre page,known,verified in app | known (strict),"Official Casaverde Neuro centre page | Matched neurorrehabilitation, neurological rehabilitation, stroke and Parkinson evidence | Madrid centre within the Casaverde neurological rehabilitation network || Centros Casaverde Neurorrehabilitación | neurorrehabilitación | rehabilitación neurológica | ictus | parkinson | centro | unidad | rehab | rehabilitación | neurolog | neuro | cerebrovascular"
Spain,Clínica San Vicente,"Madrid, Community of Madrid",https://www.clinicasanvicente.es/,curated | curated-dataset | spain-first-pass-official-seed,src/lib/data/centers.js | official neurorehabilitation clinic page,known,verified in app | known (strict),"Official neurorehabilitation clinic page | Matched brain injury, stroke and hospitalization evidence | Dedicated Madrid clinic candidate for neurological rehabilitation || daño cerebral | unidad | rehab | rehabilitación | neuro | hospital | clinic"
Spain,Hospital Beata María Ana - Unidad de Daño Cerebral Rehabilitable,"Madrid, Community of Madrid",https://fundacionhospitalariasmadrid.org/que-hacemos/unidades-especializadas/unidad-de-dano-cerebral-rehabilitable/,curated | curated-dataset | spain-first-pass-official-seed,src/lib/data/centers.js | official Fundación Hospitalarias Madrid brain injury unit page,known,verified in app | known (strict),"Official Fundación Hospitalarias Madrid brain-injury unit page | Matched neurorehabilitation, stroke, traumatic brain injury, spinal cord injury and hospitalization evidence | Specialized rehabilitable brain-injury unit || Unidad de Daño Cerebral | neurorehabilitación | neurorrehabilitación | ictus | traumatismo craneoencefálico | lesión medular | hospitalización | rehab | rehabilitación | neurolog | neuro | hospital | centro"
Spain,Hospital Casaverde Alicante,"Mutxamel, Valencian Community",https://casaverdeneuro.com/centros/alicante/hospital-casaverde/,curated | curated-dataset | spain-first-pass-official-seed,src/lib/data/centers.js | official Casaverde Neuro hospital page,known,verified in app | known (strict),"Official Casaverde Neuro hospital page | Matched neurorrehabilitation, neurological rehabilitation, stroke and Parkinson evidence | Hospital site within the Casaverde neurological rehabilitation network || Centros Casaverde Neurorrehabilitación | neurorrehabilitación | rehabilitación neurológica | ictus | parkinson | hospital | unidad | rehab | rehabilitación | neurolog | neuro | cerebrovascular | centro"
Spain,Hospital Casaverde Extremadura,"Mérida, Extremadura",https://casaverdeneuro.com/centros/extremadura/hospital-casaverde-extremadura/,curated | curated-dataset | spain-first-pass-official-seed,src/lib/data/centers.js | official Casaverde Neuro hospital page,known,verified in app | known (strict),"Official Casaverde Neuro hospital page | Matched neurorrehabilitation, neurological rehabilitation, stroke and Parkinson evidence | Hospital site within the Casaverde neurological rehabilitation network || Centros Casaverde Neurorrehabilitación | neurorrehabilitación | rehabilitación neurológica | ictus | parkinson | hospital | unidad | rehab | rehabilitación | neurolog | neuro | cerebrovascular | centro"
Spain,Hospital Casaverde Valladolid,"Valladolid, Castile and León",https://casaverdeneuro.com/centros/valladolid/hospital-casaverde-valladolid/,curated | curated-dataset | spain-first-pass-official-seed,src/lib/data/centers.js | official Casaverde Neuro hospital page,known,verified in app | known (strict),"Official Casaverde Neuro hospital page | Matched neurological rehabilitation, stroke and Parkinson evidence | Hospital site within the Casaverde neurological rehabilitation network || rehabilitación neurológica | ictus | parkinson | hospital | unidad | rehab | rehabilitación | neurolog | neuro | cerebrovascular | centro"
Spain,Hospital Los Madroños - Unidad Avanzada de Neurorrehabilitación,"Brunete, Community of Madrid",https://hospitallosmadronos.es/unidades-especializadas/unidad-avanzada-de-neurorrehabilitacion/,curated | curated-dataset | spain-first-pass-official-seed,src/lib/data/centers.js | official hospital advanced neurorehabilitation unit page,known,verified in app | known (strict),"Official hospital advanced neurorehabilitation unit page | Matched neurological rehabilitation, brain injury, stroke, TBI, spinal cord injury, MS and Parkinson evidence | Hospital-based advanced neurorehabilitation unit near Madrid || Unidad Avanzada de Neurorrehabilitación | rehabilitación neurológica | daño cerebral | ictus | traumatismo craneoencefálico | lesión medular | esclerosis múltiple | parkinson | neurorrehabilitación | rehab | rehabilitación | neurolog | neuro | cerebrovascular | hospital | clinic"
Spain,Hospital Nacional de Parapléjicos,"Toledo, Castilla-La Mancha",http://www.infomedula.org/,curated | curated-dataset,src/lib/data/centers.js,known,verified in app | known (broad),"Official site of the National Spinal Cord Injury Hospital | Rehabilitation, pediatric rehab and functional electrostimulation are listed on the official service pages | Research foundation and translational neuroscience activity || rehab | rehabilitación | neuro | hospital"
Spain,Hospital Quirónsalud Miguel Domínguez,"Pontevedra, Galicia",https://www.quironsalud.com/migueldominguez,curated | curated-dataset,src/lib/data/centers.js,known,verified in app | known (strict),"Official neuro-rehabilitation unit on the hospital site | Exoskeletons, robotics and virtual reality for neurological patients | Modern private hospital with dedicated neuro-rehab content || neurorrehabilitación | rehab | rehabilitación | neurolog | neuro | hospital | centro"
Spain,Hospital Vithas Aguas Vivas,"Carcaixent, Valencia",https://vithas.es/centro/vithas-hospital-aguas-vivas/,curated | curated-dataset,src/lib/data/centers.js,known,verified in app | known (strict),Official page states neurorrehabilitation and brain injury unit | Pool and robotic / virtual-reality rehabilitation equipment | Adult and pediatric inpatient and outpatient pathways || neurorrehabilitación | rehab | rehabilitación | neurolog | neuro | ictus | parkinson | hospital | centro
Spain,Hospital Vithas Sevilla,"Seville, Andalusia",https://vithas.es/centro/vithas-hospital-sevilla/,curated | curated-dataset,src/lib/data/centers.js,known,verified in app | known (strict),Official hospital page lists a neurorrehabilitation unit | Official page also highlights a brain-injury unit | Part of the Vithas IRENEA rehabilitation model || neurorrehabilitación | rehab | rehabilitación | neurolog | neuro | hospital | centro
Spain,Hospital Vithas Valencia Consuelo,"Valencia, Valencia",https://vithas.es/centro/vithas-hospital-valencia-consuelo/,curated | curated-dataset,src/lib/data/centers.js,known,verified in app | known (strict),Official hospital page lists a pediatric neurorrehabilitation unit | Useful coverage for pediatric neurological rehabilitation in Valencia || neurorrehabilitación | rehab | rehabilitación | neurolog | neuro | ictus | hospital | centro
Spain,Hospital Vithas Vigo,"Vigo, Galicia",https://vithas.es/centro/vithas-hospital-vigo/,curated | curated-dataset,src/lib/data/centers.js,known,verified in app | known (strict),Official hospital page lists a neurorrehabilitation unit | Adds north-west Spain coverage || neurorrehabilitación | rehab | rehabilitación | neurolog | neuro | hospital | centro
Spain,Hospital Vithas Xanit Internacional,"Benalmádena, Andalusia",https://vithas.es/centro/vithas-hospital-xanit-internacional/,curated | curated-dataset,src/lib/data/centers.js,known,verified in app | known (strict),Official hospital page lists a neurorrehabilitation unit | Part of the Vithas hospital network with the IRENEA model | Suitable as a southern Spain coverage point || neurorrehabilitación | rehab | rehabilitación | neurolog | neuro | hospital | centro
Spain,IFAS - Centro de Día de Daño Cerebral Bekoetxe,"Bilbao, Basque Country",https://ospitalarioakfundazioaeuskadi.org/es/centro/centro-dano-cerebral-bekoetxe-ifas/,curated | curated-dataset | spain-first-pass-official-seed,src/lib/data/centers.js | official Ospitalarioak filtered brain-injury centre list,known,verified in app | known (strict),"Official Bekoetxe brain-injury day-centre page | Matched neurorehabilitation, brain injury and neuropsychology evidence | IFAS day-centre candidate in Bilbao || Centro de Día de Daño Cerebral Bekoetxe | Neurorrehabilitación y daño cerebral | daño cerebral | Neuropsicología | rehabilitación | neurorrehabilitación | rehab | neuro | ictus | hospital | centro"
Spain,Institut Guttmann,"Badalona, Catalonia",https://www.guttmann.com/es,curated | curated-dataset,src/lib/data/centers.js,known,verified in app | known (strict),Hospital de Neurorrehabilitación | Investigación e Innovación | Más de 4.500 personas atendidas al año || Hospital de Neurorrehabilitación | Investigación e Innovación | neurorrehabilitación | rehab | rehabilitación | neurolog | neuro | hospital
Spain,LESCER Centro de Neurorehabilitación,"Madrid, Community of Madrid",https://www.lescer.es/,curated | curated-dataset | spain-first-pass-official-seed,src/lib/data/centers.js | official specialist neurorehabilitation centre page,known,verified in app | known (strict),"Official specialist neurorehabilitation centre page | Matched brain injury, stroke, traumatic brain injury, spinal cord injury, MS and Parkinson evidence | Official site lists hospitalization and neurological rehabilitation || neurorrehabilitación | rehabilitación neurológica | daño cerebral | ictus | traumatismo craneoencefálico | lesión medular | esclerosis múltiple | parkinson | hospitalización | rehab | rehabilitación | neurolog | neuro | hospital | centro"
Spain,Ospitalarioak Fundazioa Euskadi - Centro de Neurorrehabilitación Bilbao,"Bilbao, Basque Country",https://ospitalarioakfundazioaeuskadi.org/es/centro/centro-dano-cerebral-aita-menni-bilbao/,curated | curated-dataset | spain-first-pass-official-seed,src/lib/data/centers.js | official Ospitalarioak filtered brain-injury centre list,known,verified in app | known (strict),"Official Bilbao neurorehabilitation centre page | Specialized in rehabilitation of sequelae caused by acquired brain injury | Page lists stroke, cranioencephalic trauma, Parkinson, MS, ALS and child rehabilitation || Centro de Neurorrehabilitación | rehabilitación de las secuelas causadas por el daño cerebral adquirido | Unidad de Rehabilitación Ambulatoria | ictus | traumatismos craneoencefálicos | enfermedades neurodegenerativas | Párkinson | esclerosis múltiple | Unidad de Rehabilitación Infantil | neurorrehabilitación | rehab | rehabilitación | neurolog | neuro | cerebrovascular | hospital | centro"
Spain,Ospitalarioak Fundazioa Euskadi - Centro de Neurorrehabilitación San Sebastián,"San Sebastián, Basque Country",https://ospitalarioakfundazioaeuskadi.org/es/centro/centro-dano-cerebral-aita-menni-san-sebastian/,curated | curated-dataset | spain-first-pass-official-seed,src/lib/data/centers.js | official Ospitalarioak filtered brain-injury centre list,known,verified in app | known (strict),Official San Sebastián neurorehabilitation centre page | Official page lists neurorehabilitation and brain injury | Centre page describes a day centre for people with neurological disability and personalized care programs || Centro de Neurorrehabilitación | Neurorrehabilitación y daño cerebral | Centro de Día de Daño Cerebral | Discapacidad Neurológica | programas de atención personalizados | neurorrehabilitación | rehab | rehabilitación | neurolog | neuro | ictus | hospital | centro
Spain,Ospitalarioak Fundazioa Euskadi - Centro Musakola,"Arrasate/Mondragón, Basque Country",https://ospitalarioakfundazioaeuskadi.org/es/centro/centro-musakola/,curated | curated-dataset | spain-first-pass-official-seed,src/lib/data/centers.js | official Ospitalarioak filtered brain-injury centre list,known,verified in app | known (strict),Official Ospitalarioak filtered brain-injury centre list | Centre page states 30 day-centre places for people with brain injury | Official page lists a Centro de Día de Daño Cerebral || Neurorrehabilitación y daño cerebral | Centro de Día de Daño Cerebral | personas con daño cerebral | 30 más para personas con daño cerebral | ictus | neurorrehabilitación | rehab | rehabilitación | neuro | hospital | centro
Spain,Ospitalarioak Fundazioa Euskadi - Hospital Aita Menni,"Arrasate/Mondragón, Basque Country",https://ospitalarioakfundazioaeuskadi.org/es/centro/hospital-aita-menni/,curated | curated-dataset | spain-first-pass-official-seed,src/lib/data/centers.js | official Ospitalarioak filtered brain-injury centre list,known,verified in app | known (strict),"Official Ospitalarioak brain-injury centre page | Hospitalization unit for multidisciplinary rehabilitation of severe neurological sequelae | Page lists brain injury, stroke, cranial trauma and outpatient neurological rehabilitation || Neurorrehabilitación y daño cerebral | Unidad de Hospitalización | rehabilitación multidisciplinar | secuelas neurológicas | lesión cerebral | ictus | traumatismos craneales | afección neurológica | neurorrehabilitación | rehab | rehabilitación | neurolog | neuro | hospital | centro"
Switzerland,Balgrist University Hospital,"Zurich, Zurich",https://www.balgrist.ch/en/,curated | curated-dataset,src/lib/data/centers.js,known,verified in app | known (weak),Official site explicitly lists a Spinal Cord Injury Center | Comprehensive medical care for spinal cord injuries | Strong research and teaching environment at the University of Zurich || neuro | spinal cord | spinal | hospital | clinic
Switzerland,cereneo,"Vitznau, Lucerne",https://cereneo.ch/,curated | curated-dataset | switzerland-first-pass-official-seed,src/lib/data/centers.js | official cereneo neurorehabilitation clinic site,known,verified in app | known (strict),"Official cereneo page describes a Swiss neurorehabilitation clinic | Matched stroke, Parkinson, multiple sclerosis and traumatic brain injury evidence | Official page lists inpatient, home and online rehabilitation || Neurorehabilitation | Schlaganfall | Parkinson | Multiple Sklerose | traumatische Hirnverletzung | Stationäre Rehabilitation | neurorehabilitation | rehabilitation | rehab | neurolog | neuro | parkinson | klinik"
Switzerland,Clinica Hildebrand Centro di riabilitazione Brissago,"Brissago, Ticino",https://www.clinica-hildebrand.ch/,curated | curated-dataset | switzerland-first-pass-official-seed,src/lib/data/centers.js | official Clinica Hildebrand site,known,verified in app | known (strict),"Official Clinica Hildebrand site lists riabilitazione neurologica | Matched stroke, traumatic brain injury, multiple sclerosis, Parkinson and spinal cord pathology evidence | Official page distinguishes neurological rehabilitation from orthopaedic rehabilitation || RIABILITAZIONE NEUROLOGICA | Patologie cerebrovascolari | Trauma cranico | Sclerosi multipla | Malattia di Parkinson | Patologie del midollo spinale | riabilitazione neurologica | riabilitazione | neurolog | neuro | ictus | spinal | clinic | centro"
