country,clinic_name,location,website,source_type,discovery_source,review_status,validation,evidence
Belgium,Inkendaal,"Vlezenbeek, Flemish Brabant",https://www.inkendaal.be/,curated | curated-dataset,src/lib/data/centers.js,known,verified in app | known (broad),Reference center for several rehabilitation specialties | Official quality model and accreditation history || revalidatie | neurolog | neuro | hospital | revalidatieziekenhuis
Belgium,Revalidatieziekenhuis RevArte,"Edegem, Antwerp",https://www.mkl.be/mkl/revalidatieziekenhuis-revarte/,curated | curated-dataset,src/lib/data/centers.js,known,verified in app | known (broad),Hersenletselkliniek on the official site | Dwarslaesiekliniek on the official site | Residentieel and ambulant rehab pathways || revalidatie | neuro | dwarslaesie | hersenletsel | hospital | revalidatieziekenhuis
Croatia,Poliklinika Glavić Dubrovnik,"Dubrovnik, Dubrovnik-Neretva County",https://www.poliklinika-glavic.hr/poliklinika-dubrovnik-usluge,curated | curated-dataset | croatia-first-pass-official-seed,src/lib/data/centers.js | official Poliklinika Glavić Dubrovnik services page,known,verified in app | known (strict),"Official Dubrovnik services page lists robotic neurorehabilitation and a neurological clinic | Official text describes treatment and rehabilitation of neurological patients in Dubrovnik and Zagreb | Official indication list includes stroke, multiple sclerosis, spinal cord injuries, traumatic brain injuries, neuropathy and paraplegia || Robotska neurorehabilitacija | neurorehabilitacija robotikom | Moždani udar | Multipla skleroza | Ozljede kralježničke moždine | Traumatske ozljede mozga | neurorehabilitacija | robotska neurorehabilitacija | rehab | rehabilitacija | rehabilitacije | neurolog | neuro | moždani udar | moždanog udara | klinik | klinika"
Croatia,Poliklinika Glavić Zagreb,"Zagreb, City of Zagreb",https://www.poliklinika-glavic.hr/poliklinika-zagreb-usluge/neurorehabilitacija-robotikom,curated | curated-dataset | croatia-first-pass-official-seed,src/lib/data/centers.js | official Poliklinika Glavić Zagreb robotic neurorehabilitation page,known,verified in app | known (strict),"Official Zagreb page describes a robotic neurorehabilitation centre and reference centre for South-East Europe | Official indication list includes stroke, multiple sclerosis, spinal cord injuries, traumatic brain injuries, neuropathy and paraplegia | Official page lists Lokomat, Armeo Spring, Pablo, Amadeo and other robotic neurorehabilitation devices || Robotska neurorehabilitacija | neurorehabilitacija robotikom | Moždani udar | Multipla skleroza | Ozljede kralježničke moždine | Traumatske ozljede mozga | neurorehabilitacija | robotska neurorehabilitacija | rehab | rehabilitacija | rehabilitacije | neurolog | neuro | moždani udar | moždanog udara | klinik | klinika"
Croatia,Specijalna bolnica za medicinsku rehabilitaciju Krapinske Toplice,"Krapinske Toplice, Krapina-Zagorje County",https://www.sbkt.hr/KT/odjel-rehabilitaciju-kraniocerebralnih-bolesnika-akutnu-neurologiju/,curated | curated-dataset | croatia-first-pass-official-seed,src/lib/data/centers.js | official Krapinske Toplice special rehabilitation hospital neurorehabilitation pages,known,verified in app | known (strict),"Official site lists departments for neurological-patient rehabilitation and cranio-cerebral patient rehabilitation with acute neurology | Official cranio-cerebral department page lists 45 rehabilitation beds plus acute neurology beds | Official page describes multidisciplinary neurorehabilitation, brain-injury care, stroke neurology, robotic gait/hand rehabilitation and VR || medicinsku rehabilitaciju kraniocerebralnih bolesnika | akutnu neurologiju | Neurološka rehabilitacija | moždanog udara | robotski potpomognuta rehabilitacija | virtualne stvarnosti | neurološka rehabilitacija | rehab | rehabilitacija | rehabilitacije | neurolog | neuro | kraniocerebralnih | klinik | klinika"
Croatia,Specijalna bolnica za medicinsku rehabilitaciju Varaždinske Toplice,"Varaždinske Toplice, Varaždin County",https://www.minerva.hr/odjel-za-rehabilitaciju-neuroloskih-bolesnika/,curated | curated-dataset | croatia-first-pass-official-seed,src/lib/data/centers.js | official Varaždinske Toplice neurological-patient rehabilitation department page,known,verified in app | known (strict),Official page lists a dedicated department for rehabilitation of neurological patients | Official text covers central and peripheral nervous-system damage plus neuromuscular conditions | Official site also references a national rehabilitation centre project for spinal-cord diseases and impairments || Odjel za rehabilitaciju neuroloških bolesnika | neurološkim bolestima | neurorehabilitaciju | rehab | rehabilitacija | rehabilitacije | neurolog | neuro | spinal | kralježnične moždine | bolnica | odjel
Croatia,"Specijalna bolnica za ortopediju i rehabilitaciju ""Martin Horvat"" Rovinj-Rovigno","Rovinj, Istria County",https://www.bolnica-rovinj.hr/djelatnosti/fizikalna-medicina-i-rehabilitacija/,curated | curated-dataset | croatia-second-pass-official-seed,src/lib/data/centers.js | official Martin Horvat Rovinj physical medicine and rehabilitation page,known,verified in app | known (strict),"Official rehabilitation page lists rehabilitation for neurological problems after stroke | Official text includes neurological diseases, multiple sclerosis, muscular dystrophy, cerebral palsy, ALS and neuro-risk children | Official site lists neurology, physical medicine and rehabilitation, and a children rehabilitation department || rehabilitacija za neurološku problematiku nakon moždanog udara | rehabilitacija za neurološka oboljenja | multiplosklerozu | mišićnu distrofiju | cerebralnu paralizu | amiotrofičnu lateralnu sklerozu | rehabilitacija za neurološku problematiku | rehab | rehabilitacija | rehabilitacije | neurolog | neuro | moždanog udara | neurološka oboljenja | bolnica | odjel"
Croatia,Toplice Lipik,"Lipik, Požega-Slavonia County",https://toplice-lipik.hr/hr/medicinski-tretmani/stranica/1,curated | curated-dataset | croatia-second-pass-official-seed,src/lib/data/centers.js | official Toplice Lipik special rehabilitation hospital treatment page,known,verified in app | known (strict),"Official treatment page lists rehabilitation of neurological conditions | Official indications include post-stroke hemiparesis/hemiplegia, MS, post-traumatic peripheral nerve lesions, polyneuropathies and Parkinson disease | Official page references inpatient wards for mobile and immobile patients plus Bobath, PNF, MOTOMED, occupational therapy and speech therapy || Rehabilitacija neuroloških stanja | cerebrovaskularnog inzulta | Multipla skleroza | operacija na mozgu i kralježnici | Mb. Parkinson | neurorehabilitacije | rehabilitacija neuroloških stanja | rehabilitacija neuroloških stanja bolesti | rehab | rehabilitacija | rehabilitacije | neurolog | neuro | moždanog udara | trauma cns-a | klinik | klinika"
Croatia,University Hospital Centre Zagreb,"Zagreb, City of Zagreb",https://www.kbc-zagreb.hr/,curated | curated-dataset,src/lib/data/centers.js,known,verified in app | known (broad),"Official hospital site lists neurology, neurosurgery and rehabilitation services | Multiple campus locations including the rehabilitation facility at Božidarevićeva 11 || rehab | rehabilitacije | neurolog | neuro | spinal | živčanog sustava | hospital | klinik"
Czech Republic,Rehabilitační ústav Brandýs nad Orlicí,"Brandýs nad Orlicí, Pardubice Region",https://www.rehabilitacniustav.cz/,curated | curated-dataset,src/lib/data/centers.js,known,verified in app | known (strict),Robotická rehabilitace a neurorehabilitace on the official site | Hydrotherapy and pool services | Specialist rehab stays and high bed capacity || neurorehabilitace | rehab | rehabilitace | neuro
Estonia,Haapsalu Neurological Rehabilitation Centre,"Haapsalu, Lääne County",https://www.hnrk.ee/,curated | curated-dataset,src/lib/data/centers.js,known,verified in app | known (strict),Neurorehabilitatsiooni osakond is listed on the official site | Spinaalse rehabilitatsiooni osakond is listed on the official site | Statsionaarne and ambulatory rehab services || neurorehabilitatsioon | rehab | taastusravi | neuro | centre
France,Centre Bouffard Vercelli,"Cerbère, Occitanie",https://www.bouffard-vercelli.com/,france-pilot-official-seed,specialist rehabilitation centre seed,error,error (none),fetch failed; curl fallback failed: curl: (6) Could not resolve host: www.bouffard-vercelli.com
France,Centre de l'Arche,"Saint-Saturnin, Pays de la Loire",https://www.centre-de-larche.fr/,france-pilot-official-seed,official specialist rehabilitation centre seed,error,error (none),fetch failed; curl fallback failed: curl: (6) Could not resolve host: www.centre-de-larche.fr
France,Centre de Réadaptation de Coubert,"Coubert, Île-de-France",https://www.ugecamidf.fr/etablissement/crf-de-coubert,france-pilot-official-seed,UGECAM rehabilitation centre seed,error,error (none),"fetch failed; curl fallback failed: how to fix it, please visit the web page mentioned above."
France,Centre Mutualiste de Kerpape,"Ploemeur, Brittany",https://centre-kerpape.fr/mpr-neuro/,curated | curated-dataset | france-second-pass-official-seed,src/lib/data/centers.js | official adult neurological MPR service page,known,verified in app | known (strict),"Official adult neurological MPR service at Kerpape | Covers acquired brain injury, stroke, traumatic brain injury, MS, Parkinsonian syndromes and neuromuscular disease | Dedicated post-resuscitation neurorehab unit, conventional rehab unit and day hospital || MPR Neurologique | Médecine Physique et Réadaptation neurologique adulte | atteinte du système nerveux central | Lésions cérébrales | accident vasculaire cérébral | traumatisme crânien | Sclérose en plaques | Syndromes parkinsoniens | Unité de Réadaptation Neurologique Post Réanimation | affections du système nerveux | réadaptation neurologique | rééducation | réadaptation | neurolog | neuro | parkinson | blessés médullaires | centre"
France,Centre Propara,"Montpellier, Occitanie",https://www.propara.fr/,curated | curated-dataset | france-pilot-official-seed,src/lib/data/centers.js | official spinal cord injury rehabilitation centre seed,known,verified in app | known (strict),Official spinal cord injury rehabilitation centre seed | Matched neurological rehabilitation and spinal cord injury evidence || rééducation | réadaptation | rééducation neurologique | rehabilitation | rehab | neurolog | neuro | hospital | centre
France,CHU Angers - Les Capucins,"Angers, Pays de la Loire",https://www.les-capucins-angers.fr/,france-pilot-official-seed,specialist rehabilitation centre seed,error,error (none),No qualifying neurorehabilitation evidence found on fetched page.
France,CHU Bordeaux - Médecine physique et de réadaptation,"Bordeaux, Nouvelle-Aquitaine",https://www.chu-bordeaux.fr/Les-services/Service-de-m%C3%A9decine-physique-et-de-r%C3%A9adaptation/,curated | curated-dataset | france-pilot-official-seed,src/lib/data/centers.js | CHU MPR service seed,known,verified in app | known (strict),Official CHU MPR service page | Matched medicine physique et réadaptation and neurological evidence || médecine physique et de réadaptation | réadaptation | neuro
France,CHU Grenoble Alpes - Institut de rééducation,"Échirolles, Auvergne-Rhône-Alpes",https://www.chu-grenoble.fr/,curated | curated-dataset | france-pilot-official-seed,src/lib/data/centers.js | CHU seed / institute of rehabilitation,known,verified in app | known (strict),CHU seed for institute of rehabilitation | Official site matched neurology and rehabilitation evidence || neurologie | neurolog | neuro | hospital | centre
France,CHU Lille - Hôpital Pierre Swynghedauw,"Lille, Hauts-de-France",https://www.chu-lille.fr/hopital-pierre-swynghedauw,france-pilot-official-seed,CHU specialist rehabilitation hospital seed,error,error (none),neuro | avc
France,CHU Montpellier - Médecine physique et réadaptation,"Montpellier, Occitanie",https://www.chu-montpellier.fr/fr/offre-de-soins/consultation/medecine-physique-et-readaptation,france-pilot-official-seed,CHU MPR service seed,error,error (none),centre
France,CHU Rouen - Neuropédiatrie et MPR pédiatrique,"Rouen, Normandy",https://www.chu-rouen.fr/services/pediatrie-neonatale-et-reanimation-neuropediatrie/neuropediatrie-medecine-physique-readaptation-pediatrique/,curated | curated-dataset | france-second-pass-official-seed,src/lib/data/centers.js | official CHU Rouen neuropediatrics / pediatric MPR service page,known,verified in app | known (strict),"Official CHU Rouen neuropediatrics and pediatric MPR service | Covers central nervous system, spinal, nerve and muscle conditions in children | Includes neuropediatric day hospital, MPR day hospital and multidisciplinary follow-up || Neuropédiatrie | Médecine Physique Réadaptation pédiatrique | système nerveux central | Maladies de la moelle | Hôpital de jour MPR | maladies neuromusculaires | neurovasculaires | Polyhandicap | Handicap moteur | rééducation | réadaptation | neurolog | neuro"
France,CHU Toulouse - Médecine physique et de réadaptation,"Toulouse, Occitanie",https://www.chu-toulouse.fr/-medecine-physique-et-de-readaptation-,curated | curated-dataset | france-pilot-official-seed,src/lib/data/centers.js | CHU MPR service seed,known,verified in app | known (strict),"Official CHU MPR service page | Matched AVC, traumatic brain injury, spinal cord injury and neurological rehabilitation evidence || médecine physique et de réadaptation | neurologique | avc | traumatisme crânien | lésion médullaire | réadaptation neurologique | rééducation | réadaptation | neurolog | neuro | lesion medull | hospital | centre"
France,CMPR de Bobigny,"Bobigny, Île-de-France",https://www.cmpr-bobigny.com/,france-pilot-official-seed,specialist MPR rehabilitation centre seed,error,error (none),fetch failed; curl fallback failed: curl: (6) Could not resolve host: www.cmpr-bobigny.com
France,Fondation Hopale - Centre Jacques Calvé,"Berck, Hauts-de-France",https://www.fondation-hopale.org/,curated | curated-dataset | france-pilot-official-seed,src/lib/data/centers.js | Fondation Hopale specialist rehabilitation seed,known,verified in app | known (strict),Specialist rehabilitation centre seed from Fondation Hopale | Matched rehabilitation centre evidence || rééducation | hospital | centre
France,Hôpital Albert-Chenevier - SMR neurolocomoteur,"Créteil, Île-de-France",https://www.aphp.fr/albert-chenevier/service-de-soins-medicaux-et-de-readaptation-neurolocomoteur,curated | curated-dataset | france-pilot-official-seed,src/lib/data/centers.js | AP-HP neurolocomotor SMR service seed,known,verified in app | known (strict),"Official AP-HP service for neurolocomotor SMR | AP-HP page lists neurology, paraplegia and movement analysis expertise || soins médicaux et de réadaptation neurolocomoteur | paraplégie | neurologie | analyse du mouvement | rééducation | réadaptation | neurolog | neuro | avc | hospital"
France,Hôpital Henry Gabrielle — HCL,"Saint-Genis-Laval, Auvergne-Rhône-Alpes",https://www.chu-lyon.fr/hopital-henry-gabrielle,curated | curated-dataset,src/lib/data/centers.js,known,verified in app | known (strict),"Nationally recognized neurological rehabilitation center | Post-stroke, spinal cord injury and traumatic brain injury pathways | Piscine, gymnasium and movement-analysis laboratory || réadaptation neurologique | rééducation | réadaptation | neurolog | neuro | parkinson | avc | centre"
France,Hôpital marin de Hendaye - SMR Maladies Rares Neurologiques,"Hendaye, Nouvelle-Aquitaine",https://www.aphp.fr/hendaye/service-de-smr-maladies-rares-neurologiques-crmr-huntington,curated | curated-dataset | france-pilot-official-seed,src/lib/data/centers.js | AP-HP rare neurological diseases / Huntington SMR service seed,known,verified in app | known (strict),"Official AP-HP SMR for rare neurological diseases and Huntington | National specialist pathway with motor, cognitive and social rehabilitation || maladies rares neurologiques | huntington | réadaptation | rééducation motrice | rééducation | neurolog | neuro | avc | hospital"
France,Hôpital Maritime de Berck — AP-HP,"Berck, Hauts-de-France",https://maritimeberck.aphp.fr/presentation-de-lhopital-maritime-de-berck/,curated | curated-dataset,src/lib/data/centers.js,known,verified in app | known (strict),Official AP-HP page calls it a reference for neurological rehabilitation | Sea-water balneotherapy and dedicated rehab plateau | Adult inpatient SMR with 91 neurorehab beds || rééducation neurologique | rééducation | réadaptation | neurolog | neuro | hospital
France,Hôpital Raymond-Poincaré - Neurologie et MPR pédiatrique,"Garches, Île-de-France",https://www.aphp.fr/raymond-poincare/service-de-neurologie-et-reanimation-pediatrique-medecine-physique-et-de,curated | curated-dataset | france-pilot-official-seed,src/lib/data/centers.js | AP-HP pediatric neurology and MPR service seed,known,verified in app | known (strict),"Official AP-HP pediatric neurology and pediatric MPR service | Covers neuromuscular, cerebral and spinal pathologies in children || médecine physique et de réadaptation pédiatrique | neurologie pédiatrique | pathologies neuromusculaires | pathologies cérébrales | rééducation | réadaptation | neurolog | neuro | hospital"
France,Hôpital San Salvadour - SMR affections du système nerveux,"Hyères, Provence-Alpes-Côte d’Azur",https://www.aphp.fr/san-salvadour/service-de-soins-medicaux-et-de-readaptation-smr-affections-du-systeme-nerveux,curated | curated-dataset | france-pilot-official-seed,src/lib/data/centers.js | AP-HP adult nervous-system SMR service seed,known,verified in app | known (strict),"Official AP-HP adult nervous-system SMR service | Lists post-AVC, MS, Parkinson, spinal cord injury and traumatic brain injury rehabilitation || affections du système nerveux | rééducation post-avc | sclérose en plaques | maladie de parkinson | traumatisme cranien | rééducation des pathologies médulaires | rééducation | réadaptation | neurolog | neuro | parkinson | accident vasculaire cérébral | hospital"
France,Hôpitaux Paris Saint-Maurice,"Saint-Maurice, Île-de-France",https://www.hopitaux-saint-maurice.fr/,france-pilot-official-seed,public hospital seed / MPR neuro,error,error (none),"fetch failed; curl fallback failed: how to fix it, please visit the web page mentioned above."
France,Institut Universitaire de Réadaptation Clemenceau,"Strasbourg, Grand Est",https://www.ugecam-alsace.fr/institut-universitaire-de-readaptation-clemenceau,france-pilot-official-seed,UGECAM university rehabilitation institute seed,error,error (none),"fetch failed; curl fallback failed: how to fix it, please visit the web page mentioned above."
France,Pôle Saint-Hélier,"Rennes, Brittany",https://www.pole-sthelier.fr/,curated | curated-dataset | france-pilot-official-seed,src/lib/data/centers.js | official rehabilitation centre seed,known,verified in app | known (strict),"Official rehabilitation centre seed | Matched AVC, neurological rehabilitation and spinal cord injury evidence || avc | réadaptation | neurolog | neuro | lésions médullaires | centre"
France,Service universitaire de MPR neurologique — CHU de Nantes,"Nantes, Pays de la Loire",https://www.chu-nantes.fr/medecine-physique-et-de-readaptation-neurologique,curated | curated-dataset,src/lib/data/centers.js,known,verified in app | known (strict),Official university neuro-rehab service for severe neurological handicap | Rehab for spinal cord injury and severe brain injury | Post-ICU neurorehab pathway and movement analysis || réadaptation neurologique | rééducation | réadaptation | neurolog | neuro | lesion medull | lésion médullaire
Germany,Asklepios Klinik Schaufling,"Schaufling, Bavaria",https://www.asklepios.com/schaufling,curated | curated-dataset | germany-pilot-official-seed,src/lib/data/centers.js | Asklepios official site / specialist rehab clinic,known,verified in app | known (strict),Official Asklepios site matched neurology and neuropsychology signals | Specialist rehabilitation clinic rather than generic physiotherapy | Relevant for neurological and neuropsychological rehabilitation review || neurologie | neuropsychologie | rehabilitation | rehab | neurolog | neuro | klinik | zentrum
Germany,Asklepios Neurologische Klinik Bad Salzhausen,"Bad Salzhausen, Hesse",https://www.asklepios.com/bad-salzhausen,curated | curated-dataset | germany-pilot-official-seed,src/lib/data/centers.js | Asklepios official site / specialist neurology clinic,known,verified in app | known (strict),Official Asklepios site matched neurological clinic and neurological rehabilitation signals | Relevant for stroke and broader neurological rehabilitation | Private specialist neurology provider || neurologische klinik | neurologische rehabilitation | rehabilitation | rehab | neurolog | neuro | stroke | klinik | zentrum
Germany,BDH-Klinik Braunfels,"Braunfels, Hesse",https://www.bdh-klinik-braunfels.de/bdh-klinik-braunfels,curated | curated-dataset | germany-pilot-official-seed,src/lib/data/centers.js | BDH clinic network / official clinic site,known,verified in app | known (strict),"Official site matched stroke unit and neurological rehabilitation signals | Part of the BDH neurological rehabilitation network | Relevant for stroke, brain injury and complex neurological recovery || stroke unit | neurologische rehabilitation | rehabilitation | rehab | neurolog | neuro | stroke | klinik"
Germany,BDH-Klinik Elzach,"Elzach, Baden-Württemberg",https://www.bdh-klinik-elzach.de/,curated | curated-dataset | germany-pilot-official-seed,src/lib/data/centers.js | BDH clinic network / official clinic site,known,verified in app | known (strict),Zentrum für NeuroRehabilitation | Forschung und Lehre listed in the official navigation || neurologische rehabilitation | rehabilitation | rehab | neurolog | neuro | klinik
Germany,BDH-Klinik Greifswald,"Greifswald, Mecklenburg-Vorpommern",https://www.bdh-klinik-greifswald.de/,curated | curated-dataset | germany-pilot-official-seed,src/lib/data/centers.js | BDH clinic network / official clinic site,known,verified in app | known (strict),Zentrum für Neurorehabilitation | Schwerst schädelhirngeschädigte Patienten || Zentrum für Neurorehabilitation | neurologische rehabilitation | querschnitt | neurorehabilitation | rehabilitation | rehab | neurolog | neuro | klinik
Germany,BDH-Klinik Hessisch Oldendorf,"Hessisch Oldendorf, Lower Saxony",https://www.bdh-klinik-hessisch-oldendorf.de/,curated | curated-dataset | germany-pilot-official-seed,src/lib/data/centers.js | BDH clinic network / official clinic site,known,verified in app | known (strict),Official site matched neurological rehabilitation and medical-vocational rehabilitation signals | BDH network clinic for complex neurological rehabilitation | Relevant for stroke and acquired neurological injuries || neurologische rehabilitation | medizinisch-berufliche rehabilitation | rehabilitation | rehab | neurolog | neuro | stroke | klinik
Germany,BDH-Klinik Vallendar,"Vallendar, Rhineland-Palatinate",https://www.bdh-klinik-vallendar.de/,curated | curated-dataset | germany-pilot-official-seed,src/lib/data/centers.js | BDH clinic network / official clinic site,known,verified in app | known (strict),Official site matched neurological rehab and respiratory medicine signals | Part of the BDH rehabilitation network | Suitable for complex neurological rehabilitation review || neurologische reha | beatmungsmedizin | medizinische rehabilitation | neurologische rehabilitation | rehabilitation | rehab | neurolog | neuro | klinik
Germany,Dr. Becker Kiliani-Klinik,"Bad Windsheim, Bavaria",https://www.dbkg.de/kliniken/dr-becker-kiliani-klinik,germany-second-pass-official-seed,Dr. Becker clinic group / neurology rehabilitation seed,rejected,rejected (none),klinik
Germany,Dr. Becker Neurozentrum Niedersachsen,"Bad Essen, Lower Saxony",https://www.dbkg.de/kliniken/dr-becker-neurozentrum-niedersachsen/,curated | curated-dataset | germany-second-pass-official-seed,src/lib/data/centers.js | Dr. Becker clinic group / neurology rehabilitation seed,known,verified in app | known (weak),Approved after second-pass review | Official page matched neuro and center signals | Specialist neurology rehabilitation provider in the Dr. Becker network || neuro | zentrum
Germany,Dr. Becker Rhein-Sieg-Klinik,"Nuembrecht, North Rhine-Westphalia",https://www.dbkg.de/kliniken/dr-becker-rhein-sieg-klinik,germany-second-pass-official-seed,Dr. Becker clinic group / neurology rehabilitation seed,rejected,rejected (none),klinik
Germany,Hegau-Jugendwerk Gailingen,"Gailingen am Hochrhein, Baden-Württemberg",https://hegau-jugendwerk.de/,curated | curated-dataset | germany-pilot-official-seed,src/lib/data/centers.js | official clinic site,known,verified in app | known (strict),"Neurologisches Krankenhaus und Rehabilitationszentrum | Covers rehabilitation phases B, C, D and E | Special focus on children, adolescents and young adults || Neurologisches Krankenhaus und Rehabilitationszentrum | neurologisches krankenhaus | rehabilitationszentrum | kinder | jugendliche | neurologische rehabilitation | rehabilitation | rehab | neurolog | neuro | zentrum"
